{
  "project": {
    "name": "self/matt-pocock-skills",
    "source_path": "self/matt-pocock-skills",
    "source_type": "skill-collection",
    "source_repo_url": "https://github.com/mattpocock/skills.git"
  },
  "translator_version": "1.0.0",
  "created_at": "2026-06-25T00:00:00+08:00",
  "updated_at": "2026-06-25T00:00:00+08:00",
  "source_version": {
    "git_commit": "",
    "git_commit_short": "",
    "git_branch": "",
    "checked_at": "2026-06-25T00:00:00+08:00",
    "_note": "源文件为子模块只读副本，未捕获 git commit。下次翻译时填写。"
  },
  "summary": {
    "total_files": 62,
    "completed": 62,
    "in_progress": 0,
    "pending": 0,
    "needs_update": 0,
    "skipped": 0
  },
  "phases": [
    {
      "phase": 1,
      "name": "Phase 1: README.md 文件",
      "status": "completed",
      "completed_at": "2026-06-25T00:00:00+08:00",
      "notes": "翻译 6 个分类目录 README.md（deprecated、engineering、in-progress、misc、personal、productivity）"
    },
    {
      "phase": 2,
      "name": "Phase 2: SKILL.md 文件",
      "status": "completed",
      "completed_at": "2026-06-25T00:00:00+08:00",
      "notes": "翻译 34 个 SKILL.md，按分类从小到大批量处理：personal(2) → deprecated(4) → misc(4) → productivity(5) → in-progress(5) → engineering(14)"
    },
    {
      "phase": 3,
      "name": "Phase 3: 辅助 .md 文件",
      "status": "completed",
      "completed_at": "2026-06-25T00:00:00+08:00",
      "notes": "翻译 22 个辅助参考文件，使用子代理并行处理三个批次"
    },
    {
      "phase": 4,
      "name": "Phase 4: 质量抽查",
      "status": "completed",
      "completed_at": "2026-06-25T00:00:00+08:00",
      "notes": "抽查 DEEPENING.md、AGENT-BRIEF.md、MISSION-FORMAT.md、diagnosing-bugs/SKILL.md，翻译质量良好"
    },
    {
      "phase": 5,
      "name": "Phase 5: Python 脚本注释",
      "status": "skipped",
      "notes": "此仓库无 Python 脚本"
    },
    {
      "phase": 6,
      "name": "Phase 6: JSON 配置文件",
      "status": "skipped",
      "notes": "此仓库无 JSON 配置文件"
    }
  ],
  "files": [
    { "relative_path": "deprecated/README.md", "file_type": "README.md", "status": "completed", "category": "deprecated" },
    { "relative_path": "engineering/README.md", "file_type": "README.md", "status": "completed", "category": "engineering" },
    { "relative_path": "in-progress/README.md", "file_type": "README.md", "status": "completed", "category": "in-progress" },
    { "relative_path": "misc/README.md", "file_type": "README.md", "status": "completed", "category": "misc" },
    { "relative_path": "personal/README.md", "file_type": "README.md", "status": "completed", "category": "personal" },
    { "relative_path": "productivity/README.md", "file_type": "README.md", "status": "completed", "category": "productivity" },
    { "relative_path": "personal/edit-article/SKILL.md", "file_type": "SKILL.md", "status": "completed", "category": "personal" },
    { "relative_path": "personal/obsidian-vault/SKILL.md", "file_type": "SKILL.md", "status": "completed", "category": "personal" },
    { "relative_path": "deprecated/design-an-interface/SKILL.md", "file_type": "SKILL.md", "status": "completed", "category": "deprecated" },
    { "relative_path": "deprecated/qa/SKILL.md", "file_type": "SKILL.md", "status": "completed", "category": "deprecated" },
    { "relative_path": "deprecated/request-refactor-plan/SKILL.md", "file_type": "SKILL.md", "status": "completed", "category": "deprecated" },
    { "relative_path": "deprecated/ubiquitous-language/SKILL.md", "file_type": "SKILL.md", "status": "completed", "category": "deprecated" },
    { "relative_path": "misc/git-guardrails-claude-code/SKILL.md", "file_type": "SKILL.md", "status": "completed", "category": "misc" },
    { "relative_path": "misc/migrate-to-shoehorn/SKILL.md", "file_type": "SKILL.md", "status": "completed", "category": "misc" },
    { "relative_path": "misc/scaffold-exercises/SKILL.md", "file_type": "SKILL.md", "status": "completed", "category": "misc" },
    { "relative_path": "misc/setup-pre-commit/SKILL.md", "file_type": "SKILL.md", "status": "completed", "category": "misc" },
    { "relative_path": "productivity/grill-me/SKILL.md", "file_type": "SKILL.md", "status": "completed", "category": "productivity" },
    { "relative_path": "productivity/grilling/SKILL.md", "file_type": "SKILL.md", "status": "completed", "category": "productivity" },
    { "relative_path": "productivity/handoff/SKILL.md", "file_type": "SKILL.md", "status": "completed", "category": "productivity" },
    { "relative_path": "productivity/teach/SKILL.md", "file_type": "SKILL.md", "status": "completed", "category": "productivity" },
    { "relative_path": "productivity/writing-great-skills/SKILL.md", "file_type": "SKILL.md", "status": "completed", "category": "productivity" },
    { "relative_path": "in-progress/decision-mapping/SKILL.md", "file_type": "SKILL.md", "status": "completed", "category": "in-progress" },
    { "relative_path": "in-progress/review/SKILL.md", "file_type": "SKILL.md", "status": "completed", "category": "in-progress" },
    { "relative_path": "in-progress/writing-beats/SKILL.md", "file_type": "SKILL.md", "status": "completed", "category": "in-progress" },
    { "relative_path": "in-progress/writing-fragments/SKILL.md", "file_type": "SKILL.md", "status": "completed", "category": "in-progress" },
    { "relative_path": "in-progress/writing-shape/SKILL.md", "file_type": "SKILL.md", "status": "completed", "category": "in-progress" },
    { "relative_path": "engineering/ask-matt/SKILL.md", "file_type": "SKILL.md", "status": "completed", "category": "engineering" },
    { "relative_path": "engineering/codebase-design/SKILL.md", "file_type": "SKILL.md", "status": "completed", "category": "engineering" },
    { "relative_path": "engineering/diagnosing-bugs/SKILL.md", "file_type": "SKILL.md", "status": "completed", "category": "engineering" },
    { "relative_path": "engineering/domain-modeling/SKILL.md", "file_type": "SKILL.md", "status": "completed", "category": "engineering" },
    { "relative_path": "engineering/grill-with-docs/SKILL.md", "file_type": "SKILL.md", "status": "completed", "category": "engineering" },
    { "relative_path": "engineering/implement/SKILL.md", "file_type": "SKILL.md", "status": "completed", "category": "engineering" },
    { "relative_path": "engineering/improve-codebase-architecture/SKILL.md", "file_type": "SKILL.md", "status": "completed", "category": "engineering" },
    { "relative_path": "engineering/prototype/SKILL.md", "file_type": "SKILL.md", "status": "completed", "category": "engineering" },
    { "relative_path": "engineering/resolving-merge-conflicts/SKILL.md", "file_type": "SKILL.md", "status": "completed", "category": "engineering" },
    { "relative_path": "engineering/setup-matt-pocock-skills/SKILL.md", "file_type": "SKILL.md", "status": "completed", "category": "engineering" },
    { "relative_path": "engineering/tdd/SKILL.md", "file_type": "SKILL.md", "status": "completed", "category": "engineering" },
    { "relative_path": "engineering/to-issues/SKILL.md", "file_type": "SKILL.md", "status": "completed", "category": "engineering" },
    { "relative_path": "engineering/to-prd/SKILL.md", "file_type": "SKILL.md", "status": "completed", "category": "engineering" },
    { "relative_path": "engineering/triage/SKILL.md", "file_type": "SKILL.md", "status": "completed", "category": "engineering" },
    { "relative_path": "engineering/codebase-design/DEEPENING.md", "file_type": "other-md", "status": "completed", "category": "engineering" },
    { "relative_path": "engineering/codebase-design/DESIGN-IT-TWICE.md", "file_type": "other-md", "status": "completed", "category": "engineering" },
    { "relative_path": "engineering/domain-modeling/ADR-FORMAT.md", "file_type": "other-md", "status": "completed", "category": "engineering" },
    { "relative_path": "engineering/domain-modeling/CONTEXT-FORMAT.md", "file_type": "other-md", "status": "completed", "category": "engineering" },
    { "relative_path": "engineering/improve-codebase-architecture/HTML-REPORT.md", "file_type": "other-md", "status": "completed", "category": "engineering" },
    { "relative_path": "engineering/prototype/LOGIC.md", "file_type": "other-md", "status": "completed", "category": "engineering" },
    { "relative_path": "engineering/prototype/UI.md", "file_type": "other-md", "status": "completed", "category": "engineering" },
    { "relative_path": "engineering/setup-matt-pocock-skills/domain.md", "file_type": "other-md", "status": "completed", "category": "engineering" },
    { "relative_path": "engineering/setup-matt-pocock-skills/issue-tracker-github.md", "file_type": "other-md", "status": "completed", "category": "engineering" },
    { "relative_path": "engineering/setup-matt-pocock-skills/issue-tracker-gitlab.md", "file_type": "other-md", "status": "completed", "category": "engineering" },
    { "relative_path": "engineering/setup-matt-pocock-skills/issue-tracker-local.md", "file_type": "other-md", "status": "completed", "category": "engineering" },
    { "relative_path": "engineering/setup-matt-pocock-skills/triage-labels.md", "file_type": "other-md", "status": "completed", "category": "engineering" },
    { "relative_path": "engineering/tdd/mocking.md", "file_type": "other-md", "status": "completed", "category": "engineering" },
    { "relative_path": "engineering/tdd/refactoring.md", "file_type": "other-md", "status": "completed", "category": "engineering" },
    { "relative_path": "engineering/tdd/tests.md", "file_type": "other-md", "status": "completed", "category": "engineering" },
    { "relative_path": "engineering/triage/AGENT-BRIEF.md", "file_type": "other-md", "status": "completed", "category": "engineering" },
    { "relative_path": "engineering/triage/OUT-OF-SCOPE.md", "file_type": "other-md", "status": "completed", "category": "engineering" },
    { "relative_path": "productivity/teach/GLOSSARY-FORMAT.md", "file_type": "other-md", "status": "completed", "category": "productivity" },